{
  "schema_version": "assay-evidence/v1",
  "event_id": "RUN-1791689400521595900-5840:S-08",
  "run_id": "RUN-1791689400521595900-5840",
  "lineage": {
    "change_id": "CH-001",
    "claim_ids": [
      "C-008"
    ],
    "obligation_ids": [],
    "origins": [
      "assay-protocol"
    ],
    "assumption_ids": [],
    "trust_assumptions": []
  },
  "subject": {
    "manifest_fingerprint": "fnv1a:09950008473cd2cc"
  },
  "checker": {
    "id": "S-08",
    "capability": "self-test",
    "strength": 5,
    "scope": "unbounded",
    "bound": null,
    "stage": "pr",
    "command_fingerprint": "fnv1a:be47e6d420deab0b",
    "engine_version": "0.6.0"
  },
  "result": {
    "verdict": "pass",
    "exit_code": 0,
    "started_at": "2026-10-11T03:30:06Z",
    "duration_s": 0.97,
    "detail": "PASS: 有界检查未能冒充穷举（exit=1）"
  },
  "birth_certificate": {
    "status": "reproduced",
    "note": "已复现过（棘轮记录）；`run --certify` 可当场重跑"
  }
}