{
  "schema_version": "assay-evidence/v1",
  "event_id": "RUN-1791539842334485500-24752:S-02",
  "run_id": "RUN-1791539842334485500-24752",
  "lineage": {
    "claim_ids": [
      "C-002"
    ],
    "obligation_ids": [],
    "origins": [
      "assay-protocol"
    ],
    "assumption_ids": [],
    "trust_assumptions": [
      "S-02 是文本检查：证明源码里没有工具名，不能证明引擎行为上不依赖某个工具。承担者：人（复审唯一构造 Command 的那一处 exec_shell）"
    ]
  },
  "subject": {
    "manifest_fingerprint": "fnv1a:badf7bfa0c0329f5"
  },
  "checker": {
    "id": "S-02",
    "capability": "structural",
    "strength": 5,
    "scope": "unbounded",
    "bound": null,
    "stage": "pre-commit",
    "command_fingerprint": "fnv1a:0bdeced555fbb5aa",
    "engine_version": "0.5.0"
  },
  "result": {
    "verdict": "pass",
    "exit_code": 0,
    "started_at": "2026-10-09T09:57:23Z",
    "duration_s": 1.33,
    "detail": "PASS: engine/src 零后端工具名（0 命中）"
  },
  "birth_certificate": {
    "status": "reproduced",
    "note": "已复现过（棘轮记录）；`run --certify` 可当场重跑"
  }
}