{
  "schema_version": "assay-evidence/v1",
  "event_id": "RUN-1791689411149791400-21128:S-12",
  "run_id": "RUN-1791689411149791400-21128",
  "lineage": {
    "change_id": "CH-003",
    "claim_ids": [
      "C-012"
    ],
    "obligation_ids": [
      "O-050"
    ],
    "origins": [],
    "assumption_ids": [],
    "trust_assumptions": [
      "本检查只覆盖 `tools/**/*.py` 这一条 glob 路径，作为 CODE_PATTERNS 全集的代表。其余模式的同类回归要靠同一条实现共享，不由本检查逐条证明。承担者：ledger_lint 维护者"
    ]
  },
  "subject": {
    "manifest_fingerprint": "fnv1a:09950008473cd2cc"
  },
  "checker": {
    "id": "S-12",
    "capability": "structural",
    "strength": 5,
    "scope": "unbounded",
    "bound": null,
    "stage": "pre-commit",
    "command_fingerprint": "fnv1a:23c6cfcf9dd29224",
    "engine_version": "0.6.0"
  },
  "result": {
    "verdict": "pass",
    "exit_code": 0,
    "started_at": "2026-10-11T03:30:15Z",
    "duration_s": 2.48,
    "detail": "PASS: 未忽略的新文件在作用域内（①）；命中忽略规则的文件移出作用域（②）"
  },
  "birth_certificate": {
    "status": "reproduced",
    "note": "已复现过（棘轮记录）；`run --certify` 可当场重跑"
  }
}