{
  "schema_version": "assay-evidence/v1",
  "event_id": "RUN-1791539842334485500-24752:S-03",
  "run_id": "RUN-1791539842334485500-24752",
  "lineage": {
    "claim_ids": [
      "C-003"
    ],
    "obligation_ids": [],
    "origins": [
      "assay-protocol"
    ],
    "assumption_ids": [],
    "trust_assumptions": []
  },
  "subject": {
    "manifest_fingerprint": "fnv1a:badf7bfa0c0329f5"
  },
  "checker": {
    "id": "S-03",
    "capability": "self-test",
    "strength": 5,
    "scope": "unbounded",
    "bound": null,
    "stage": "pre-commit",
    "command_fingerprint": "fnv1a:469ca758760b8181",
    "engine_version": "0.5.0"
  },
  "result": {
    "verdict": "pass",
    "exit_code": 0,
    "started_at": "2026-10-09T09:57:25Z",
    "duration_s": 1.51,
    "detail": "PASS: 未知子命令 exit=2，说明原因且不产出判定"
  },
  "birth_certificate": {
    "status": "reproduced",
    "note": "已复现过（棘轮记录）；`run --certify` 可当场重跑"
  }
}