{
  "schema_version": "assay-evidence/v1",
  "event_id": "RUN-1791689411149791400-21128:S-10",
  "run_id": "RUN-1791689411149791400-21128",
  "lineage": {
    "change_id": "CH-003",
    "claim_ids": [
      "C-010"
    ],
    "obligation_ids": [
      "O-048"
    ],
    "origins": [],
    "assumption_ids": [],
    "trust_assumptions": [
      "doctor 只查首词能否在 PATH 或仓库内解析到，**不执行**任何被声明的命令。因此它证不了'命令能跑通'，只证得了'命令找得到'。承担者：清单作者（首次 run 时确认）"
    ]
  },
  "subject": {
    "manifest_fingerprint": "fnv1a:09950008473cd2cc"
  },
  "checker": {
    "id": "S-10",
    "capability": "structural",
    "strength": 5,
    "scope": "unbounded",
    "bound": null,
    "stage": "pre-commit",
    "command_fingerprint": "fnv1a:c4c68d7ad799274d",
    "engine_version": "0.6.0"
  },
  "result": {
    "verdict": "pass",
    "exit_code": 0,
    "started_at": "2026-10-11T03:30:12Z",
    "duration_s": 1.37,
    "detail": "PASS: 解析不到的命令被抓出且点名（exit=2）；可解析的命令不误伤"
  },
  "birth_certificate": {
    "status": "reproduced",
    "note": "已复现过（棘轮记录）；`run --certify` 可当场重跑"
  }
}