{
  "schema_version": "assay-evidence/v1",
  "event_id": "RUN-1791689408517874100-23248:S-09",
  "run_id": "RUN-1791689408517874100-23248",
  "lineage": {
    "change_id": "CH-002",
    "claim_ids": [
      "C-009"
    ],
    "obligation_ids": [],
    "origins": [
      "assay-protocol"
    ],
    "assumption_ids": [],
    "trust_assumptions": [
      "引擎只能报出「清单里已有的绑定」上的分歧。它不知道两个检查是否在判同一件事——那是人的判断。承担者：清单作者"
    ]
  },
  "subject": {
    "manifest_fingerprint": "fnv1a:09950008473cd2cc"
  },
  "checker": {
    "id": "S-09",
    "capability": "self-test",
    "strength": 5,
    "scope": "unbounded",
    "bound": null,
    "stage": "pr",
    "command_fingerprint": "fnv1a:050c8a8ad108a5bc",
    "engine_version": "0.6.0"
  },
  "result": {
    "verdict": "pass",
    "exit_code": 0,
    "started_at": "2026-10-11T03:30:09Z",
    "duration_s": 0.99,
    "detail": "PASS: 分歧被报出并点名（K-9A 绿 / K-9B 红），run exit=1"
  },
  "birth_certificate": {
    "status": "reproduced",
    "note": "已复现过（棘轮记录）；`run --certify` 可当场重跑"
  }
}